{
  "test_case_id": "TC-023",
  "variant_id": "v42",
  "language": "R",
  "package": "stats",
  "package_version": "4",
  "overall": {
    "dcr_experimental": 67.6,
    "dcr_control": 36,
    "n_experimental": 102,
    "n_control": 86,
    "disease_controlled_exp": 69,
    "disease_controlled_ctrl": 31,
    "ci_lower_experimental": 58.1,
    "ci_upper_experimental": 75.9,
    "ci_lower_control": 26.7,
    "ci_upper_control": 46.6,
    "dcr_difference": 31.6,
    "diff_ci_lower": 18,
    "diff_ci_upper": 45.2
  },
  "subgroups": [
    {
      "subgroup": "SEX",
      "level": "Male",
      "dcr_experimental": 66.2,
      "dcr_control": 36,
      "n_experimental": 68,
      "n_control": 50,
      "disease_controlled_exp": 45,
      "disease_controlled_ctrl": 18,
      "ci_lower_experimental": 54.3,
      "ci_upper_experimental": 76.3,
      "ci_lower_control": 24.1,
      "ci_upper_control": 49.9,
      "dcr_difference": 30.2,
      "diff_ci_lower": 12.8,
      "diff_ci_upper": 47.6
    },
    {
      "subgroup": "SEX",
      "level": "Female",
      "dcr_experimental": 70.6,
      "dcr_control": 36.1,
      "n_experimental": 34,
      "n_control": 36,
      "disease_controlled_exp": 24,
      "disease_controlled_ctrl": 13,
      "ci_lower_experimental": 53.8,
      "ci_upper_experimental": 83.2,
      "ci_lower_control": 22.5,
      "ci_upper_control": 52.4,
      "dcr_difference": 34.5,
      "diff_ci_lower": 12.6,
      "diff_ci_upper": 56.4
    },
    {
      "subgroup": "AGEGR1",
      "level": "<65",
      "dcr_experimental": 66.7,
      "dcr_control": 36.9,
      "n_experimental": 69,
      "n_control": 65,
      "disease_controlled_exp": 46,
      "disease_controlled_ctrl": 24,
      "ci_lower_experimental": 54.9,
      "ci_upper_experimental": 76.6,
      "ci_lower_control": 26.2,
      "ci_upper_control": 49.1,
      "dcr_difference": 29.7,
      "diff_ci_lower": 13.6,
      "diff_ci_upper": 45.9
    },
    {
      "subgroup": "AGEGR1",
      "level": ">=65",
      "dcr_experimental": 69.7,
      "dcr_control": 33.3,
      "n_experimental": 33,
      "n_control": 21,
      "disease_controlled_exp": 23,
      "disease_controlled_ctrl": 7,
      "ci_lower_experimental": 52.7,
      "ci_upper_experimental": 82.6,
      "ci_lower_control": 17.2,
      "ci_upper_control": 54.6,
      "dcr_difference": 36.4,
      "diff_ci_lower": 10.8,
      "diff_ci_upper": 61.9
    },
    {
      "subgroup": "ECOG",
      "level": "0",
      "dcr_experimental": 68.8,
      "dcr_control": 45.5,
      "n_experimental": 64,
      "n_control": 55,
      "disease_controlled_exp": 44,
      "disease_controlled_ctrl": 25,
      "ci_lower_experimental": 56.6,
      "ci_upper_experimental": 78.8,
      "ci_lower_control": 33,
      "ci_upper_control": 58.5,
      "dcr_difference": 23.3,
      "diff_ci_lower": 5.9,
      "diff_ci_upper": 40.7
    },
    {
      "subgroup": "ECOG",
      "level": "1",
      "dcr_experimental": 65.8,
      "dcr_control": 19.4,
      "n_experimental": 38,
      "n_control": 31,
      "disease_controlled_exp": 25,
      "disease_controlled_ctrl": 6,
      "ci_lower_experimental": 49.9,
      "ci_upper_experimental": 78.8,
      "ci_lower_control": 9.2,
      "ci_upper_control": 36.3,
      "dcr_difference": 46.4,
      "diff_ci_lower": 25.9,
      "diff_ci_upper": 67
    }
  ],
  "bor_distribution": [
    {
      "arm": "Experimental",
      "bor": "CR",
      "n": 14,
      "pct": 13.7
    },
    {
      "arm": "Experimental",
      "bor": "PR",
      "n": 24,
      "pct": 23.5
    },
    {
      "arm": "Experimental",
      "bor": "SD",
      "n": 31,
      "pct": 30.4
    },
    {
      "arm": "Experimental",
      "bor": "PD",
      "n": 33,
      "pct": 32.4
    },
    {
      "arm": "Control",
      "bor": "CR",
      "n": 2,
      "pct": 2.3
    },
    {
      "arm": "Control",
      "bor": "PR",
      "n": 12,
      "pct": 14
    },
    {
      "arm": "Control",
      "bor": "SD",
      "n": 17,
      "pct": 19.8
    },
    {
      "arm": "Control",
      "bor": "PD",
      "n": 55,
      "pct": 64
    }
  ],
  "endpoint": "DCR",
  "population": "ITT",
  "dcr_definition": "CR + PR + SD",
  "seed": 42
}
